{
  "$schema": "synthetic-baby-data/1.0",
  "schema_version": "1.0",
  "profile_name": "Privatia Rigatoni",
  "profile_source": "results/synthetic-baby-profile.json",
  "captures_scanned": 1,
  "apps_with_transmission": 0,
  "method": "marker search of the raw local capture (request body, response body, and URL). Sanitized network logs are not searched.",
  "scope": "Markers come from the fictional synthetic baby profile. A match in a request body or URL proves the entered value left the device. The committed, sanitized network logs are not searched because their bodies are redacted.",
  "apps": [
    {
      "app": "pebbi",
      "package_name": "",
      "capture": "results/pebbi-test-20261004/artifacts/captures/pebbi.mitm",
      "flows_scanned": 51,
      "markers_matched": 4,
      "transmission_observed": false,
      "recipients": [
        "firebase-settings.crashlytics.com",
        "firebaseinstallations.googleapis.com",
        "play.googleapis.com"
      ],
      "verdict": "no_transmission_detected",
      "claim_limit": "not observed in this capture window under marker search of the raw file. This does not prove the app never sends the value.",
      "findings": [
        {
          "marker_id": "nursing_timeout_min",
          "marker_type": "numeric",
          "marker_confidence": "low",
          "method": "GET",
          "host": "firebase-settings.crashlytics.com",
          "path": "https://firebase-settings.crashlytics.com/spi/v2/platforms/android/gmp/1:341351821472:android:14124c1ebb45d70fc499c5/settings?instance=187e408a97c9d0ecdcb6e51442d91195d8252d8d&build_version=39&display_version=3.2.1&source=1",
          "status": 200,
          "vendor": "Google/Firebase",
          "recipient_class": "known_third_party",
          "side": "request"
        },
        {
          "marker_id": "nursing_timeout_min",
          "marker_type": "numeric",
          "marker_confidence": "low",
          "method": "POST",
          "host": "firebaseinstallations.googleapis.com",
          "path": "https://firebaseinstallations.googleapis.com/v1/projects/pebbi-app/installations",
          "status": 200,
          "vendor": "Google/Firebase",
          "recipient_class": "known_third_party",
          "side": "request"
        },
        {
          "marker_id": "nursing_timeout_min",
          "marker_type": "numeric",
          "marker_confidence": "low",
          "method": "GET",
          "host": "firebase-settings.crashlytics.com",
          "path": "https://firebase-settings.crashlytics.com/spi/v2/platforms/android/gmp/1%3A341351821472%3Aandroid%3A14124c1ebb45d70fc499c5/settings?build_version=39&display_version=3.2.1",
          "status": 200,
          "vendor": "Google/Firebase",
          "recipient_class": "known_third_party",
          "side": "url"
        },
        {
          "marker_id": "formula_click_increment",
          "marker_type": "numeric",
          "marker_confidence": "low",
          "method": "POST",
          "host": "play.googleapis.com",
          "path": "https://play.googleapis.com/play/log?format=raw&proto_v2=true",
          "status": 200,
          "vendor": "Google/Firebase",
          "recipient_class": "known_third_party",
          "side": "request"
        }
      ]
    }
  ]
}
